{
  "kind": "approved-slice-plan-export-v0",
  "version": 1,
  "status": "approved",
  "supersedes": null,
  "generated_from": "envelope skill batch run 2026-07-02, weak-tier P0 integrity tickets BEI-128 BEI-129 BEI-130 (teotl unification program)",
  "source_work_contract": "~/Personal/teotl/plans/2026-07-02-teotl-unification-core-extraction-spec.md (approved 2026-07-02; companion debt audit 2026-07-02-debt-audit-p0-integrity-batch.md)",
  "slice_plan": {
    "phase": "P0 stop-the-bleeding integrity batch",
    "parallel_groups": [["bei-128-action-policy-schema", "bei-130-install-traps"]],
    "notes": "bei-129 depends on bei-128 (both edit scripts/action_policy.py; workspace serialization). bei-130 is file-disjoint and runs in parallel."
  },
  "children": [
    {"id": "bei-128-action-policy-schema", "source_ticket": "BEI-128"},
    {"id": "bei-129-redaction-parity", "source_ticket": "BEI-129"},
    {"id": "bei-130-install-traps", "source_ticket": "BEI-130"}
  ],
  "dependency_graph": {
    "bei-128-action-policy-schema": [],
    "bei-129-redaction-parity": ["bei-128-action-policy-schema"],
    "bei-130-install-traps": []
  },
  "proof_requirements": [
    {
      "kind": "proof-requirement-v1",
      "id": "beislid-tool-tests",
      "type": "command_gate",
      "stage": "pre-pr",
      "status": "required",
      "description": "Per-tool test scripts for the touched scripts plus repo consistency gates.",
      "success_criteria": [
        "bash scripts/test_action_policy.sh exits 0",
        "bash scripts/test_run_ledger.sh exits 0",
        "bash scripts/test_install.sh exits 0 (bei-130)",
        "git diff --check origin/main...HEAD exits 0"
      ],
      "failure_policy": {"on_missing": "block", "on_failure": "block", "retryable": true},
      "expected_artifact": {"kind": "gate_envelope", "reference": "run-ledger gate path or transcript-safe summary"}
    }
  ],
  "guides_and_gates": {
    "gates": ["diff-whitespace", "install-integration-tests"],
    "gate_commands": {
      "diff-whitespace": "git diff --check origin/main...HEAD",
      "install-integration-tests": "bash scripts/test_install.sh",
      "tool-tests": "bash scripts/test_action_policy.sh && bash scripts/test_run_ledger.sh"
    },
    "guides": ["Scripts are Python stdlib-only and must stay standalone-runnable; ticket AFK brief is the authoritative slice brief"]
  },
  "approval": {
    "approved_at": "2026-07-02T17:10:23Z",
    "approved_by": "Vic Valenzuela <victor@dala.care>",
    "verdicts": {
      "bei-128-action-policy-schema": "approve",
      "bei-129-redaction-parity": "approve",
      "bei-130-install-traps": "approve"
    }
  },
  "runner_extensions": {
    "model_routing": {
      "routing": [
        {"boundary": "implementation", "tier": "standard", "mode": "prefer", "reason": "weak-tier P0 batch: mechanical, evidence-pinned fixes routed cheap by design", "source": {"skill": "envelope", "phase": "execution"}},
        {"boundary": "review_fix", "tier": "standard", "mode": "prefer", "reason": "review-fix iterations stay on the default tier", "source": {"skill": "envelope"}},
        {"boundary": "gate_repair", "tier": "standard", "mode": "prefer", "reason": "gate repair is mechanical against exact commands", "source": {"skill": "envelope"}}
      ],
      "tier": "standard",
      "mode": "prefer",
      "candidates": ["sonnet"]
    }
  },
  "validation": {
    "schema_version": "approved-slice-plan-export-v0",
    "rubric_version": "afk-rubric-v1",
    "notes": "All include paths probed with test -f in the authoring session (install_lib.sh located at scripts/install_lib.sh, correcting the ticket's root-path reference); python3 and bash probed; repo pinned at main db52c3863e48703a9b2ad57c1e581b307f483894. bei-129's edge on bei-128 is file-overlap serialization on action_policy.py, not semantic."
  },
  "ownership": {
    "beislid": "Defines planning, autonomy, and proof semantics of this bundle; owns the scripts being fixed.",
    "rondo": "Owns execution and run evidence produced while carrying out the envelopes.",
    "memento": "Owns durable memory and learning captured from completed work.",
    "teotl": "Program umbrella; no runtime responsibility."
  }
}
